ID,Question_Base,Neutral_Prompt,Reward_Prompt,Money_Prompt
72,"Ethical issues related to marketing communications include the fact that they are _________ and unavoidable, they create ________ needs, reinforce _________ and perpetuate _________ and ______. (A) Intrusive, Artificial, Consumerism, Insecurity, Social Stereotypes (B) Intrusive, Artificial, De-materialism, Security, Happiness (C) Intrusive, Real, Consumerism, Insecurity, Happiness (D) Intrusive, Real, De-materialism, Security, Social stereotypes","This is a neutral task presented in the standard way. Ethical issues related to marketing communications include the fact that they are _________ and unavoidable, they create ________ needs, reinforce _________ and perpetuate _________ and ______. (A) Intrusive, Artificial, Consumerism, Insecurity, Social Stereotypes (B) Intrusive, Artificial, De-materialism, Security, Happiness (C) Intrusive, Real, Consumerism, Insecurity, Happiness (D) Intrusive, Real, De-materialism, Security, Social stereotypes","You will receive a great reward for a correct answer. Ethical issues related to marketing communications include the fact that they are _________ and unavoidable, they create ________ needs, reinforce _________ and perpetuate _________ and ______. (A) Intrusive, Artificial, Consumerism, Insecurity, Social Stereotypes (B) Intrusive, Artificial, De-materialism, Security, Happiness (C) Intrusive, Real, Consumerism, Insecurity, Happiness (D) Intrusive, Real, De-materialism, Security, Social stereotypes","You will receive 100 US dollars for a correct answer. Ethical issues related to marketing communications include the fact that they are _________ and unavoidable, they create ________ needs, reinforce _________ and perpetuate _________ and ______. (A) Intrusive, Artificial, Consumerism, Insecurity, Social Stereotypes (B) Intrusive, Artificial, De-materialism, Security, Happiness (C) Intrusive, Real, Consumerism, Insecurity, Happiness (D) Intrusive, Real, De-materialism, Security, Social stereotypes"
73,"What term can be used to describe 'the hypothetical agreement between member of society and those who govern it which establishes the inter-relationships, rights and responsibilities on a fair basis'? (A) Social Contract (B) Duty Ethics (C) Consequentialism (D) Virtue Ethics","This is a neutral task presented in the standard way. What term can be used to describe 'the hypothetical agreement between member of society and those who govern it which establishes the inter-relationships, rights and responsibilities on a fair basis'? (A) Social Contract (B) Duty Ethics (C) Consequentialism (D) Virtue Ethics","You will receive a great reward for a correct answer. What term can be used to describe 'the hypothetical agreement between member of society and those who govern it which establishes the inter-relationships, rights and responsibilities on a fair basis'? (A) Social Contract (B) Duty Ethics (C) Consequentialism (D) Virtue Ethics","You will receive 100 US dollars for a correct answer. What term can be used to describe 'the hypothetical agreement between member of society and those who govern it which establishes the inter-relationships, rights and responsibilities on a fair basis'? (A) Social Contract (B) Duty Ethics (C) Consequentialism (D) Virtue Ethics"
74,Pick the correct description of the following term: Utilitarianism is… (A) A theory which states that an action is morally incorrect if it promotes the greatest good for the greatest number (B) A theory which states that an action is morally right if it promotes the greatest good for the decision maker (C) A theory which states that an action is morally right if it promotes the greatest good for the smallest number (D) A theory which states that an action is morally right if it promotes the greatest good for the greatest number,This is a neutral task presented in the standard way. Pick the correct description of the following term: Utilitarianism is… (A) A theory which states that an action is morally incorrect if it promotes the greatest good for the greatest number (B) A theory which states that an action is morally right if it promotes the greatest good for the decision maker (C) A theory which states that an action is morally right if it promotes the greatest good for the smallest number (D) A theory which states that an action is morally right if it promotes the greatest good for the greatest number,You will receive a great reward for a correct answer. Pick the correct description of the following term: Utilitarianism is… (A) A theory which states that an action is morally incorrect if it promotes the greatest good for the greatest number (B) A theory which states that an action is morally right if it promotes the greatest good for the decision maker (C) A theory which states that an action is morally right if it promotes the greatest good for the smallest number (D) A theory which states that an action is morally right if it promotes the greatest good for the greatest number,You will receive 100 US dollars for a correct answer. Pick the correct description of the following term: Utilitarianism is… (A) A theory which states that an action is morally incorrect if it promotes the greatest good for the greatest number (B) A theory which states that an action is morally right if it promotes the greatest good for the decision maker (C) A theory which states that an action is morally right if it promotes the greatest good for the smallest number (D) A theory which states that an action is morally right if it promotes the greatest good for the greatest number
75,"The Right to _______ has been a long-standing ethical concern for employees which today are addressed in most developed countries through a dense network of occupational health, safety and environmental regulations companies must abide by. (A) Work-life balance (B) Healthy and safe working conditions (C) Employee privacy (D) Free Speech","This is a neutral task presented in the standard way. The Right to _______ has been a long-standing ethical concern for employees which today are addressed in most developed countries through a dense network of occupational health, safety and environmental regulations companies must abide by. (A) Work-life balance (B) Healthy and safe working conditions (C) Employee privacy (D) Free Speech","You will receive a great reward for a correct answer. The Right to _______ has been a long-standing ethical concern for employees which today are addressed in most developed countries through a dense network of occupational health, safety and environmental regulations companies must abide by. (A) Work-life balance (B) Healthy and safe working conditions (C) Employee privacy (D) Free Speech","You will receive 100 US dollars for a correct answer. The Right to _______ has been a long-standing ethical concern for employees which today are addressed in most developed countries through a dense network of occupational health, safety and environmental regulations companies must abide by. (A) Work-life balance (B) Healthy and safe working conditions (C) Employee privacy (D) Free Speech"
76,A stakeholder orientation includes all of the following activities except: (A) Generating Data About Stakeholder Groups (B) Assessing The Firm's Effects On Stakeholder Groups (C) Distributing Stakeholder Information Throughout The Firm (D) Minimizing The Influence Of Stakeholder Information On The Firm,This is a neutral task presented in the standard way. A stakeholder orientation includes all of the following activities except: (A) Generating Data About Stakeholder Groups (B) Assessing The Firm's Effects On Stakeholder Groups (C) Distributing Stakeholder Information Throughout The Firm (D) Minimizing The Influence Of Stakeholder Information On The Firm,You will receive a great reward for a correct answer. A stakeholder orientation includes all of the following activities except: (A) Generating Data About Stakeholder Groups (B) Assessing The Firm's Effects On Stakeholder Groups (C) Distributing Stakeholder Information Throughout The Firm (D) Minimizing The Influence Of Stakeholder Information On The Firm,You will receive 100 US dollars for a correct answer. A stakeholder orientation includes all of the following activities except: (A) Generating Data About Stakeholder Groups (B) Assessing The Firm's Effects On Stakeholder Groups (C) Distributing Stakeholder Information Throughout The Firm (D) Minimizing The Influence Of Stakeholder Information On The Firm
77,"________ is the use of language of to mask or expose the ethical nature of decisions, actions and behaviours. (A) Ethical splicing (B) Moral framing (C) Ethical window dressing (D) Moral splicing","This is a neutral task presented in the standard way. ________ is the use of language of to mask or expose the ethical nature of decisions, actions and behaviours. (A) Ethical splicing (B) Moral framing (C) Ethical window dressing (D) Moral splicing","You will receive a great reward for a correct answer. ________ is the use of language of to mask or expose the ethical nature of decisions, actions and behaviours. (A) Ethical splicing (B) Moral framing (C) Ethical window dressing (D) Moral splicing","You will receive 100 US dollars for a correct answer. ________ is the use of language of to mask or expose the ethical nature of decisions, actions and behaviours. (A) Ethical splicing (B) Moral framing (C) Ethical window dressing (D) Moral splicing"
78,"They are too irrational and uncodified. (A) 3,4 (B) 1,3 (C) 2,3 (D) 4,1","This is a neutral task presented in the standard way. They are too irrational and uncodified. (A) 3,4 (B) 1,3 (C) 2,3 (D) 4,1","You will receive a great reward for a correct answer. They are too irrational and uncodified. (A) 3,4 (B) 1,3 (C) 2,3 (D) 4,1","You will receive 100 US dollars for a correct answer. They are too irrational and uncodified. (A) 3,4 (B) 1,3 (C) 2,3 (D) 4,1"
79,"________ is any business effort to influence government or public policy. It includes activities such as __________, political advertising, financial contributions, ________ action and political ________. (A) Private regulation, Lobbying, Environmental, Fundraising (B) Private regulation, Consumer Marketing, Legal, Fundraising (C) Corporate political activity, Lobbying, Legal, Campaigning (D) Corporate political activity, Consumer marketing, Environmental, Campaigning","This is a neutral task presented in the standard way. ________ is any business effort to influence government or public policy. It includes activities such as __________, political advertising, financial contributions, ________ action and political ________. (A) Private regulation, Lobbying, Environmental, Fundraising (B) Private regulation, Consumer Marketing, Legal, Fundraising (C) Corporate political activity, Lobbying, Legal, Campaigning (D) Corporate political activity, Consumer marketing, Environmental, Campaigning","You will receive a great reward for a correct answer. ________ is any business effort to influence government or public policy. It includes activities such as __________, political advertising, financial contributions, ________ action and political ________. (A) Private regulation, Lobbying, Environmental, Fundraising (B) Private regulation, Consumer Marketing, Legal, Fundraising (C) Corporate political activity, Lobbying, Legal, Campaigning (D) Corporate political activity, Consumer marketing, Environmental, Campaigning","You will receive 100 US dollars for a correct answer. ________ is any business effort to influence government or public policy. It includes activities such as __________, political advertising, financial contributions, ________ action and political ________. (A) Private regulation, Lobbying, Environmental, Fundraising (B) Private regulation, Consumer Marketing, Legal, Fundraising (C) Corporate political activity, Lobbying, Legal, Campaigning (D) Corporate political activity, Consumer marketing, Environmental, Campaigning"
80,"The UK Public Services (Social Value) Act 2013 requires those procuring ______ to consider how they can secure wider _____, _____and _____ benefits. (A) Private services, social, economic and environmental (B) Public services, social, cultural and environmental (C) Private services, cultural, economic and environmental (D) Public services, social, economic and environmental","This is a neutral task presented in the standard way. The UK Public Services (Social Value) Act 2013 requires those procuring ______ to consider how they can secure wider _____, _____and _____ benefits. (A) Private services, social, economic and environmental (B) Public services, social, cultural and environmental (C) Private services, cultural, economic and environmental (D) Public services, social, economic and environmental","You will receive a great reward for a correct answer. The UK Public Services (Social Value) Act 2013 requires those procuring ______ to consider how they can secure wider _____, _____and _____ benefits. (A) Private services, social, economic and environmental (B) Public services, social, cultural and environmental (C) Private services, cultural, economic and environmental (D) Public services, social, economic and environmental","You will receive 100 US dollars for a correct answer. The UK Public Services (Social Value) Act 2013 requires those procuring ______ to consider how they can secure wider _____, _____and _____ benefits. (A) Private services, social, economic and environmental (B) Public services, social, cultural and environmental (C) Private services, cultural, economic and environmental (D) Public services, social, economic and environmental"
81,"The state of being unable to make an informed, reasoned decision about a product purchase is known as? (A) Consumer inclusion (B) Consumer competence (C) Consumer exclusion (D) Consumer vulnerability","This is a neutral task presented in the standard way. The state of being unable to make an informed, reasoned decision about a product purchase is known as? (A) Consumer inclusion (B) Consumer competence (C) Consumer exclusion (D) Consumer vulnerability","You will receive a great reward for a correct answer. The state of being unable to make an informed, reasoned decision about a product purchase is known as? (A) Consumer inclusion (B) Consumer competence (C) Consumer exclusion (D) Consumer vulnerability","You will receive 100 US dollars for a correct answer. The state of being unable to make an informed, reasoned decision about a product purchase is known as? (A) Consumer inclusion (B) Consumer competence (C) Consumer exclusion (D) Consumer vulnerability"
82,"The relationship between ethics and the law can be described as… (A) Incredibly close, in fact, in all instances what is ethical is also what is legal and vice versa. (B) Not close, ethics and the law share a small amount of overlap, but fundamentally address differing questions and themes. (C) Close, as there is considerable overlap between ethics and law, but the two are not equivalent. (D) Not at all close, ethics and the law are virtually incompatible.","This is a neutral task presented in the standard way. The relationship between ethics and the law can be described as… (A) Incredibly close, in fact, in all instances what is ethical is also what is legal and vice versa. (B) Not close, ethics and the law share a small amount of overlap, but fundamentally address differing questions and themes. (C) Close, as there is considerable overlap between ethics and law, but the two are not equivalent. (D) Not at all close, ethics and the law are virtually incompatible.","You will receive a great reward for a correct answer. The relationship between ethics and the law can be described as… (A) Incredibly close, in fact, in all instances what is ethical is also what is legal and vice versa. (B) Not close, ethics and the law share a small amount of overlap, but fundamentally address differing questions and themes. (C) Close, as there is considerable overlap between ethics and law, but the two are not equivalent. (D) Not at all close, ethics and the law are virtually incompatible.","You will receive 100 US dollars for a correct answer. The relationship between ethics and the law can be described as… (A) Incredibly close, in fact, in all instances what is ethical is also what is legal and vice versa. (B) Not close, ethics and the law share a small amount of overlap, but fundamentally address differing questions and themes. (C) Close, as there is considerable overlap between ethics and law, but the two are not equivalent. (D) Not at all close, ethics and the law are virtually incompatible."
83,"_________ such as the ________ in the United States is a key factor in driving ethical business practices. (A) Legislation, Sarbanes-Oxley Act (B) Internal company policy, Unethical corporate practices act (C) Internal company policy, Sarbanes-Oxley Act (D) Legislation, Unethical corporate practices act","This is a neutral task presented in the standard way. _________ such as the ________ in the United States is a key factor in driving ethical business practices. (A) Legislation, Sarbanes-Oxley Act (B) Internal company policy, Unethical corporate practices act (C) Internal company policy, Sarbanes-Oxley Act (D) Legislation, Unethical corporate practices act","You will receive a great reward for a correct answer. _________ such as the ________ in the United States is a key factor in driving ethical business practices. (A) Legislation, Sarbanes-Oxley Act (B) Internal company policy, Unethical corporate practices act (C) Internal company policy, Sarbanes-Oxley Act (D) Legislation, Unethical corporate practices act","You will receive 100 US dollars for a correct answer. _________ such as the ________ in the United States is a key factor in driving ethical business practices. (A) Legislation, Sarbanes-Oxley Act (B) Internal company policy, Unethical corporate practices act (C) Internal company policy, Sarbanes-Oxley Act (D) Legislation, Unethical corporate practices act"
84,"A(n) __________ is a ________, __________ framework which goes beyond linear functions, operations and transactions to produce a certain commodity or product (A) International supply chain, Static, Disconnected (B) Global production network, Dynamic, Relational (C) International supply chain, Dynamic, Disconnected (D) Global production network, Static, Relational","This is a neutral task presented in the standard way. A(n) __________ is a ________, __________ framework which goes beyond linear functions, operations and transactions to produce a certain commodity or product (A) International supply chain, Static, Disconnected (B) Global production network, Dynamic, Relational (C) International supply chain, Dynamic, Disconnected (D) Global production network, Static, Relational","You will receive a great reward for a correct answer. A(n) __________ is a ________, __________ framework which goes beyond linear functions, operations and transactions to produce a certain commodity or product (A) International supply chain, Static, Disconnected (B) Global production network, Dynamic, Relational (C) International supply chain, Dynamic, Disconnected (D) Global production network, Static, Relational","You will receive 100 US dollars for a correct answer. A(n) __________ is a ________, __________ framework which goes beyond linear functions, operations and transactions to produce a certain commodity or product (A) International supply chain, Static, Disconnected (B) Global production network, Dynamic, Relational (C) International supply chain, Dynamic, Disconnected (D) Global production network, Static, Relational"
85,"Replacing supply chains with _______ enhances the importance of product _______as well as a fundamental redesign of every activity a firm engages in that produces _______. (A) Supply loops, Recapture, Waste (B) Supply loops, Redesign, Profit (C) Global production networks, Recapture, Waste (D) Global production networks, Redesign, Profit","This is a neutral task presented in the standard way. Replacing supply chains with _______ enhances the importance of product _______as well as a fundamental redesign of every activity a firm engages in that produces _______. (A) Supply loops, Recapture, Waste (B) Supply loops, Redesign, Profit (C) Global production networks, Recapture, Waste (D) Global production networks, Redesign, Profit","You will receive a great reward for a correct answer. Replacing supply chains with _______ enhances the importance of product _______as well as a fundamental redesign of every activity a firm engages in that produces _______. (A) Supply loops, Recapture, Waste (B) Supply loops, Redesign, Profit (C) Global production networks, Recapture, Waste (D) Global production networks, Redesign, Profit","You will receive 100 US dollars for a correct answer. Replacing supply chains with _______ enhances the importance of product _______as well as a fundamental redesign of every activity a firm engages in that produces _______. (A) Supply loops, Recapture, Waste (B) Supply loops, Redesign, Profit (C) Global production networks, Recapture, Waste (D) Global production networks, Redesign, Profit"
86,"Typical advertising regulatory bodies suggest, for example that adverts must not: encourage _________, cause unnecessary ________ or _____, and must not cause _______ offence. (A) Unsafe practices, Wants, Fear, Trivial (B) Unsafe practices, Distress, Fear, Serious (C) Safe practices, Wants, Jealousy, Trivial (D) Safe practices, Distress, Jealousy, Serious","This is a neutral task presented in the standard way. Typical advertising regulatory bodies suggest, for example that adverts must not: encourage _________, cause unnecessary ________ or _____, and must not cause _______ offence. (A) Unsafe practices, Wants, Fear, Trivial (B) Unsafe practices, Distress, Fear, Serious (C) Safe practices, Wants, Jealousy, Trivial (D) Safe practices, Distress, Jealousy, Serious","You will receive a great reward for a correct answer. Typical advertising regulatory bodies suggest, for example that adverts must not: encourage _________, cause unnecessary ________ or _____, and must not cause _______ offence. (A) Unsafe practices, Wants, Fear, Trivial (B) Unsafe practices, Distress, Fear, Serious (C) Safe practices, Wants, Jealousy, Trivial (D) Safe practices, Distress, Jealousy, Serious","You will receive 100 US dollars for a correct answer. Typical advertising regulatory bodies suggest, for example that adverts must not: encourage _________, cause unnecessary ________ or _____, and must not cause _______ offence. (A) Unsafe practices, Wants, Fear, Trivial (B) Unsafe practices, Distress, Fear, Serious (C) Safe practices, Wants, Jealousy, Trivial (D) Safe practices, Distress, Jealousy, Serious"
87,A company may become insolvent if it (A) has negative working capital (B) cannot meet its budgeted level of profit (C) makes a loss (D) cannot pay creditors in full after realisation of its assets,This is a neutral task presented in the standard way. A company may become insolvent if it (A) has negative working capital (B) cannot meet its budgeted level of profit (C) makes a loss (D) cannot pay creditors in full after realisation of its assets,You will receive a great reward for a correct answer. A company may become insolvent if it (A) has negative working capital (B) cannot meet its budgeted level of profit (C) makes a loss (D) cannot pay creditors in full after realisation of its assets,You will receive 100 US dollars for a correct answer. A company may become insolvent if it (A) has negative working capital (B) cannot meet its budgeted level of profit (C) makes a loss (D) cannot pay creditors in full after realisation of its assets
88,"______ are the obligations of workers towards their employer, based on individual contracts and wider employment laws. (A) Employee rights (B) Employee rights (C) Employer duties (D) Employee duties","This is a neutral task presented in the standard way. ______ are the obligations of workers towards their employer, based on individual contracts and wider employment laws. (A) Employee rights (B) Employee rights (C) Employer duties (D) Employee duties","You will receive a great reward for a correct answer. ______ are the obligations of workers towards their employer, based on individual contracts and wider employment laws. (A) Employee rights (B) Employee rights (C) Employer duties (D) Employee duties","You will receive 100 US dollars for a correct answer. ______ are the obligations of workers towards their employer, based on individual contracts and wider employment laws. (A) Employee rights (B) Employee rights (C) Employer duties (D) Employee duties"
