ID,Question_Base,Neutral_Prompt,Reward_Prompt,Money_Prompt
39,"Businesses engage in social accounting due to demands from _________, in order to identify ________, to improve ___________ and to encourage _________ and ___________ (A) Stakeholders, Risks, Stakeholder management, Accountability, Transparency (B) Stakeholders, Accountability, Transparency, Risks, Stakeholder Management (C) Stakeholders, Accountability, Risks, Stakeholders, Stakeholder Management (D) Stakeholders, Stakeholder Management, Transparency, Risks, Accountability","This is a neutral task presented in the standard way. Businesses engage in social accounting due to demands from _________, in order to identify ________, to improve ___________ and to encourage _________ and ___________ (A) Stakeholders, Risks, Stakeholder management, Accountability, Transparency (B) Stakeholders, Accountability, Transparency, Risks, Stakeholder Management (C) Stakeholders, Accountability, Risks, Stakeholders, Stakeholder Management (D) Stakeholders, Stakeholder Management, Transparency, Risks, Accountability","You will receive a great reward for a correct answer. Businesses engage in social accounting due to demands from _________, in order to identify ________, to improve ___________ and to encourage _________ and ___________ (A) Stakeholders, Risks, Stakeholder management, Accountability, Transparency (B) Stakeholders, Accountability, Transparency, Risks, Stakeholder Management (C) Stakeholders, Accountability, Risks, Stakeholders, Stakeholder Management (D) Stakeholders, Stakeholder Management, Transparency, Risks, Accountability","You will receive 100 US dollars for a correct answer. Businesses engage in social accounting due to demands from _________, in order to identify ________, to improve ___________ and to encourage _________ and ___________ (A) Stakeholders, Risks, Stakeholder management, Accountability, Transparency (B) Stakeholders, Accountability, Transparency, Risks, Stakeholder Management (C) Stakeholders, Accountability, Risks, Stakeholders, Stakeholder Management (D) Stakeholders, Stakeholder Management, Transparency, Risks, Accountability"
40,"Which of the following statements is correct? (A) Business ethics is not a real concept as the rules and ethics of everyday life don't apply to the world of business. (B) Business Ethics is the study of business situations, activities and decisions where issues of right and wrong are addressed. (C) Business ethics cannot be defined as a real concept as it is an oxymoronic term. (D) Business ethics is concerned with the study of assessing the activities of a business based on their profitability.","This is a neutral task presented in the standard way. Which of the following statements is correct? (A) Business ethics is not a real concept as the rules and ethics of everyday life don't apply to the world of business. (B) Business Ethics is the study of business situations, activities and decisions where issues of right and wrong are addressed. (C) Business ethics cannot be defined as a real concept as it is an oxymoronic term. (D) Business ethics is concerned with the study of assessing the activities of a business based on their profitability.","You will receive a great reward for a correct answer. Which of the following statements is correct? (A) Business ethics is not a real concept as the rules and ethics of everyday life don't apply to the world of business. (B) Business Ethics is the study of business situations, activities and decisions where issues of right and wrong are addressed. (C) Business ethics cannot be defined as a real concept as it is an oxymoronic term. (D) Business ethics is concerned with the study of assessing the activities of a business based on their profitability.","You will receive 100 US dollars for a correct answer. Which of the following statements is correct? (A) Business ethics is not a real concept as the rules and ethics of everyday life don't apply to the world of business. (B) Business Ethics is the study of business situations, activities and decisions where issues of right and wrong are addressed. (C) Business ethics cannot be defined as a real concept as it is an oxymoronic term. (D) Business ethics is concerned with the study of assessing the activities of a business based on their profitability."
41,"____________ refers to a strategic process involving stakeholder assessment to create long-term relationships with customers, while maintaining, supporting, and enhancing the natural environment. (A) Eco-strategy (B) Green Marketing (C) Superfund reauthorization (D) Recycle and reprocess management","This is a neutral task presented in the standard way. ____________ refers to a strategic process involving stakeholder assessment to create long-term relationships with customers, while maintaining, supporting, and enhancing the natural environment. (A) Eco-strategy (B) Green Marketing (C) Superfund reauthorization (D) Recycle and reprocess management","You will receive a great reward for a correct answer. ____________ refers to a strategic process involving stakeholder assessment to create long-term relationships with customers, while maintaining, supporting, and enhancing the natural environment. (A) Eco-strategy (B) Green Marketing (C) Superfund reauthorization (D) Recycle and reprocess management","You will receive 100 US dollars for a correct answer. ____________ refers to a strategic process involving stakeholder assessment to create long-term relationships with customers, while maintaining, supporting, and enhancing the natural environment. (A) Eco-strategy (B) Green Marketing (C) Superfund reauthorization (D) Recycle and reprocess management"
42,"_____ is a key driving force shaping the current and future state of business ethics, in particular regarding _____, ______ and _____ related issues. (A) Globalisation, Cultural, Legal, Accountability (B) Nationalisation, Cultural, Environmental, Accountability (C) Privatisation, Cultural, Legal, Accountability (D) Globalisation, Technological, Financial, Accountability","This is a neutral task presented in the standard way. _____ is a key driving force shaping the current and future state of business ethics, in particular regarding _____, ______ and _____ related issues. (A) Globalisation, Cultural, Legal, Accountability (B) Nationalisation, Cultural, Environmental, Accountability (C) Privatisation, Cultural, Legal, Accountability (D) Globalisation, Technological, Financial, Accountability","You will receive a great reward for a correct answer. _____ is a key driving force shaping the current and future state of business ethics, in particular regarding _____, ______ and _____ related issues. (A) Globalisation, Cultural, Legal, Accountability (B) Nationalisation, Cultural, Environmental, Accountability (C) Privatisation, Cultural, Legal, Accountability (D) Globalisation, Technological, Financial, Accountability","You will receive 100 US dollars for a correct answer. _____ is a key driving force shaping the current and future state of business ethics, in particular regarding _____, ______ and _____ related issues. (A) Globalisation, Cultural, Legal, Accountability (B) Nationalisation, Cultural, Environmental, Accountability (C) Privatisation, Cultural, Legal, Accountability (D) Globalisation, Technological, Financial, Accountability"
43,_________ are individual beliefs about desirable behaviours and goals that are stable over time and which influence decision making. (A) Character traits (B) Personal values (C) Personal attitudes (D) Personal traits,This is a neutral task presented in the standard way. _________ are individual beliefs about desirable behaviours and goals that are stable over time and which influence decision making. (A) Character traits (B) Personal values (C) Personal attitudes (D) Personal traits,You will receive a great reward for a correct answer. _________ are individual beliefs about desirable behaviours and goals that are stable over time and which influence decision making. (A) Character traits (B) Personal values (C) Personal attitudes (D) Personal traits,You will receive 100 US dollars for a correct answer. _________ are individual beliefs about desirable behaviours and goals that are stable over time and which influence decision making. (A) Character traits (B) Personal values (C) Personal attitudes (D) Personal traits
44,"Traditionally consumer rights were based on the notion of _______ or _______ where the responsibility lay with consumer to avoid subpar products. However, this has gradually eroded due to increased ________ at a ________, EU and UN level. (A) Caveat emptor, Company Responsibility, Informal codes, International (B) Caveat emptor, Buyer beware, Regulation, National (C) Cemptor Eaveat, Buyer beware, Regulation, National (D) Cemptor Eaveat, Company Responsibility, Informal Codes, International","This is a neutral task presented in the standard way. Traditionally consumer rights were based on the notion of _______ or _______ where the responsibility lay with consumer to avoid subpar products. However, this has gradually eroded due to increased ________ at a ________, EU and UN level. (A) Caveat emptor, Company Responsibility, Informal codes, International (B) Caveat emptor, Buyer beware, Regulation, National (C) Cemptor Eaveat, Buyer beware, Regulation, National (D) Cemptor Eaveat, Company Responsibility, Informal Codes, International","You will receive a great reward for a correct answer. Traditionally consumer rights were based on the notion of _______ or _______ where the responsibility lay with consumer to avoid subpar products. However, this has gradually eroded due to increased ________ at a ________, EU and UN level. (A) Caveat emptor, Company Responsibility, Informal codes, International (B) Caveat emptor, Buyer beware, Regulation, National (C) Cemptor Eaveat, Buyer beware, Regulation, National (D) Cemptor Eaveat, Company Responsibility, Informal Codes, International","You will receive 100 US dollars for a correct answer. Traditionally consumer rights were based on the notion of _______ or _______ where the responsibility lay with consumer to avoid subpar products. However, this has gradually eroded due to increased ________ at a ________, EU and UN level. (A) Caveat emptor, Company Responsibility, Informal codes, International (B) Caveat emptor, Buyer beware, Regulation, National (C) Cemptor Eaveat, Buyer beware, Regulation, National (D) Cemptor Eaveat, Company Responsibility, Informal Codes, International"
45,"_______ working practices refer to working patterns which involve temporal, spatial and task related fluidity. (A) Dynamic (B) Fluid (C) Flexible (D) Modern","This is a neutral task presented in the standard way. _______ working practices refer to working patterns which involve temporal, spatial and task related fluidity. (A) Dynamic (B) Fluid (C) Flexible (D) Modern","You will receive a great reward for a correct answer. _______ working practices refer to working patterns which involve temporal, spatial and task related fluidity. (A) Dynamic (B) Fluid (C) Flexible (D) Modern","You will receive 100 US dollars for a correct answer. _______ working practices refer to working patterns which involve temporal, spatial and task related fluidity. (A) Dynamic (B) Fluid (C) Flexible (D) Modern"
46,"A corporation is ________ from its managers, employees, investors and customers. It therefore has _______ succession and also ________. (A) Indistinguishable, Perpetual, Does not own its own assets (B) Independent, Limited, Owns its own assets (C) Independent, Perpetual, Owns its own assets (D) Indistinguishable, Perpetual, Owns its own assets","This is a neutral task presented in the standard way. A corporation is ________ from its managers, employees, investors and customers. It therefore has _______ succession and also ________. (A) Indistinguishable, Perpetual, Does not own its own assets (B) Independent, Limited, Owns its own assets (C) Independent, Perpetual, Owns its own assets (D) Indistinguishable, Perpetual, Owns its own assets","You will receive a great reward for a correct answer. A corporation is ________ from its managers, employees, investors and customers. It therefore has _______ succession and also ________. (A) Indistinguishable, Perpetual, Does not own its own assets (B) Independent, Limited, Owns its own assets (C) Independent, Perpetual, Owns its own assets (D) Indistinguishable, Perpetual, Owns its own assets","You will receive 100 US dollars for a correct answer. A corporation is ________ from its managers, employees, investors and customers. It therefore has _______ succession and also ________. (A) Indistinguishable, Perpetual, Does not own its own assets (B) Independent, Limited, Owns its own assets (C) Independent, Perpetual, Owns its own assets (D) Indistinguishable, Perpetual, Owns its own assets"
47,"Although the benefit and contribution of civil society in encouraging sustainability, lobbying on important issues and helping the needy are taken for granted in many places, in many other countries, such as _____ and ______ civil society is far less developed than in, for instance, _______. (A) Russia, China, Britain (B) Norway, China, Russia (C) Britain, United States, Australia (D) Canada, Russia, United States","This is a neutral task presented in the standard way. Although the benefit and contribution of civil society in encouraging sustainability, lobbying on important issues and helping the needy are taken for granted in many places, in many other countries, such as _____ and ______ civil society is far less developed than in, for instance, _______. (A) Russia, China, Britain (B) Norway, China, Russia (C) Britain, United States, Australia (D) Canada, Russia, United States","You will receive a great reward for a correct answer. Although the benefit and contribution of civil society in encouraging sustainability, lobbying on important issues and helping the needy are taken for granted in many places, in many other countries, such as _____ and ______ civil society is far less developed than in, for instance, _______. (A) Russia, China, Britain (B) Norway, China, Russia (C) Britain, United States, Australia (D) Canada, Russia, United States","You will receive 100 US dollars for a correct answer. Although the benefit and contribution of civil society in encouraging sustainability, lobbying on important issues and helping the needy are taken for granted in many places, in many other countries, such as _____ and ______ civil society is far less developed than in, for instance, _______. (A) Russia, China, Britain (B) Norway, China, Russia (C) Britain, United States, Australia (D) Canada, Russia, United States"
48,"________ are a business ethics management tool that have grown over the last few decades. Areas which these typically cover are compliance, corruption and environmental issues. However, they are constantly evolving, with for example, the onus on __________ having grown in recent years. (A) Annual reports, Company financial performance (B) Annual report, Internet - social media and networking (C) Codes of ethics, Company financial performance (D) Codes of ethics, Internet - social media and networking","This is a neutral task presented in the standard way. ________ are a business ethics management tool that have grown over the last few decades. Areas which these typically cover are compliance, corruption and environmental issues. However, they are constantly evolving, with for example, the onus on __________ having grown in recent years. (A) Annual reports, Company financial performance (B) Annual report, Internet - social media and networking (C) Codes of ethics, Company financial performance (D) Codes of ethics, Internet - social media and networking","You will receive a great reward for a correct answer. ________ are a business ethics management tool that have grown over the last few decades. Areas which these typically cover are compliance, corruption and environmental issues. However, they are constantly evolving, with for example, the onus on __________ having grown in recent years. (A) Annual reports, Company financial performance (B) Annual report, Internet - social media and networking (C) Codes of ethics, Company financial performance (D) Codes of ethics, Internet - social media and networking","You will receive 100 US dollars for a correct answer. ________ are a business ethics management tool that have grown over the last few decades. Areas which these typically cover are compliance, corruption and environmental issues. However, they are constantly evolving, with for example, the onus on __________ having grown in recent years. (A) Annual reports, Company financial performance (B) Annual report, Internet - social media and networking (C) Codes of ethics, Company financial performance (D) Codes of ethics, Internet - social media and networking"
49,"The so-called BRIC countries (Brazil, Russia, India and _______) tend to follow a __________ approach to corporate governance. However, recently this has tended to move towards more _______-based mechanisms. (A) Canada, Market, Relationship (B) China, Market, Relationship (C) Canada, Relationship, Market (D) China, Relationship, Market","This is a neutral task presented in the standard way. The so-called BRIC countries (Brazil, Russia, India and _______) tend to follow a __________ approach to corporate governance. However, recently this has tended to move towards more _______-based mechanisms. (A) Canada, Market, Relationship (B) China, Market, Relationship (C) Canada, Relationship, Market (D) China, Relationship, Market","You will receive a great reward for a correct answer. The so-called BRIC countries (Brazil, Russia, India and _______) tend to follow a __________ approach to corporate governance. However, recently this has tended to move towards more _______-based mechanisms. (A) Canada, Market, Relationship (B) China, Market, Relationship (C) Canada, Relationship, Market (D) China, Relationship, Market","You will receive 100 US dollars for a correct answer. The so-called BRIC countries (Brazil, Russia, India and _______) tend to follow a __________ approach to corporate governance. However, recently this has tended to move towards more _______-based mechanisms. (A) Canada, Market, Relationship (B) China, Market, Relationship (C) Canada, Relationship, Market (D) China, Relationship, Market"
50,Which of the following areas is not covered by the principles enshrined in the UN Global Compact? (A) Human rights (B) Labour (C) Commercial performance (D) Anti-corruption,This is a neutral task presented in the standard way. Which of the following areas is not covered by the principles enshrined in the UN Global Compact? (A) Human rights (B) Labour (C) Commercial performance (D) Anti-corruption,You will receive a great reward for a correct answer. Which of the following areas is not covered by the principles enshrined in the UN Global Compact? (A) Human rights (B) Labour (C) Commercial performance (D) Anti-corruption,You will receive 100 US dollars for a correct answer. Which of the following areas is not covered by the principles enshrined in the UN Global Compact? (A) Human rights (B) Labour (C) Commercial performance (D) Anti-corruption
51,"What, according to Schnackenberg and Tomlinson (2014), are the three criteria which can be used to assess the quality of corporate transparency? (A) Breadth, Clarity, Accuracy (B) Disclosure, Detail, Accuracy (C) Disclosure, Clarity, Accuracy (D) Disclosure, Clarity, Efficiency","This is a neutral task presented in the standard way. What, according to Schnackenberg and Tomlinson (2014), are the three criteria which can be used to assess the quality of corporate transparency? (A) Breadth, Clarity, Accuracy (B) Disclosure, Detail, Accuracy (C) Disclosure, Clarity, Accuracy (D) Disclosure, Clarity, Efficiency","You will receive a great reward for a correct answer. What, according to Schnackenberg and Tomlinson (2014), are the three criteria which can be used to assess the quality of corporate transparency? (A) Breadth, Clarity, Accuracy (B) Disclosure, Detail, Accuracy (C) Disclosure, Clarity, Accuracy (D) Disclosure, Clarity, Efficiency","You will receive 100 US dollars for a correct answer. What, according to Schnackenberg and Tomlinson (2014), are the three criteria which can be used to assess the quality of corporate transparency? (A) Breadth, Clarity, Accuracy (B) Disclosure, Detail, Accuracy (C) Disclosure, Clarity, Accuracy (D) Disclosure, Clarity, Efficiency"
52,Which of the following is not one the underlying principles of the corporate governance Combined Code of Practice? (A) Openness (B) Integrity (C) Availability (D) Acceptability,This is a neutral task presented in the standard way. Which of the following is not one the underlying principles of the corporate governance Combined Code of Practice? (A) Openness (B) Integrity (C) Availability (D) Acceptability,You will receive a great reward for a correct answer. Which of the following is not one the underlying principles of the corporate governance Combined Code of Practice? (A) Openness (B) Integrity (C) Availability (D) Acceptability,You will receive 100 US dollars for a correct answer. Which of the following is not one the underlying principles of the corporate governance Combined Code of Practice? (A) Openness (B) Integrity (C) Availability (D) Acceptability
53,"Businesses have _____ within society and have the potential to provide a ____ to society while ____ has the potential to inflict enormous harm on individuals, communities and the environment. (A) Little power, Small contribution, Business malpractice (B) Little power, Major contribution, Corporate social responsibility (C) Huge power, Small contribution, Corporate social responsibility (D) Huge power, Major contribution, Business malpractice","This is a neutral task presented in the standard way. Businesses have _____ within society and have the potential to provide a ____ to society while ____ has the potential to inflict enormous harm on individuals, communities and the environment. (A) Little power, Small contribution, Business malpractice (B) Little power, Major contribution, Corporate social responsibility (C) Huge power, Small contribution, Corporate social responsibility (D) Huge power, Major contribution, Business malpractice","You will receive a great reward for a correct answer. Businesses have _____ within society and have the potential to provide a ____ to society while ____ has the potential to inflict enormous harm on individuals, communities and the environment. (A) Little power, Small contribution, Business malpractice (B) Little power, Major contribution, Corporate social responsibility (C) Huge power, Small contribution, Corporate social responsibility (D) Huge power, Major contribution, Business malpractice","You will receive 100 US dollars for a correct answer. Businesses have _____ within society and have the potential to provide a ____ to society while ____ has the potential to inflict enormous harm on individuals, communities and the environment. (A) Little power, Small contribution, Business malpractice (B) Little power, Major contribution, Corporate social responsibility (C) Huge power, Small contribution, Corporate social responsibility (D) Huge power, Major contribution, Business malpractice"
54,"_______ can be a likened to their natural counterparts, comprising of a balanced network of interdependent organisms and their environments thus adding value to sustainability thinking due to the consideration of companies and industries as being bound together, and interdependent due to all kinds of resources and wastes. (A) Industrial supply loops (B) Industrial ecosystems (C) Ecological ecosystems (D) Corporate ecosystems","This is a neutral task presented in the standard way. _______ can be a likened to their natural counterparts, comprising of a balanced network of interdependent organisms and their environments thus adding value to sustainability thinking due to the consideration of companies and industries as being bound together, and interdependent due to all kinds of resources and wastes. (A) Industrial supply loops (B) Industrial ecosystems (C) Ecological ecosystems (D) Corporate ecosystems","You will receive a great reward for a correct answer. _______ can be a likened to their natural counterparts, comprising of a balanced network of interdependent organisms and their environments thus adding value to sustainability thinking due to the consideration of companies and industries as being bound together, and interdependent due to all kinds of resources and wastes. (A) Industrial supply loops (B) Industrial ecosystems (C) Ecological ecosystems (D) Corporate ecosystems","You will receive 100 US dollars for a correct answer. _______ can be a likened to their natural counterparts, comprising of a balanced network of interdependent organisms and their environments thus adding value to sustainability thinking due to the consideration of companies and industries as being bound together, and interdependent due to all kinds of resources and wastes. (A) Industrial supply loops (B) Industrial ecosystems (C) Ecological ecosystems (D) Corporate ecosystems"
