ID,Question_Base,Neutral_Prompt,Reward_Prompt,Money_Prompt
20,"Some of key differences between Islamic finance and conventional finance include - prohibition of charging and paying _______, prohibition on ______ and ______ transactions, prohibition of sinful investment and requirement for all financial products to be backed by __________. (A) Interest, Certain, Speculative, Intangible assets (B) Interest, Uncertain, Assured, Intangible assets (C) Interest, Uncertain, Speculative, Tangible assets (D) Interest, Certain, Assured, Tangible assets","This is a neutral task presented in the standard way. Some of key differences between Islamic finance and conventional finance include - prohibition of charging and paying _______, prohibition on ______ and ______ transactions, prohibition of sinful investment and requirement for all financial products to be backed by __________. (A) Interest, Certain, Speculative, Intangible assets (B) Interest, Uncertain, Assured, Intangible assets (C) Interest, Uncertain, Speculative, Tangible assets (D) Interest, Certain, Assured, Tangible assets","You will receive a great reward for a correct answer. Some of key differences between Islamic finance and conventional finance include - prohibition of charging and paying _______, prohibition on ______ and ______ transactions, prohibition of sinful investment and requirement for all financial products to be backed by __________. (A) Interest, Certain, Speculative, Intangible assets (B) Interest, Uncertain, Assured, Intangible assets (C) Interest, Uncertain, Speculative, Tangible assets (D) Interest, Certain, Assured, Tangible assets","You will receive 100 US dollars for a correct answer. Some of key differences between Islamic finance and conventional finance include - prohibition of charging and paying _______, prohibition on ______ and ______ transactions, prohibition of sinful investment and requirement for all financial products to be backed by __________. (A) Interest, Certain, Speculative, Intangible assets (B) Interest, Uncertain, Assured, Intangible assets (C) Interest, Uncertain, Speculative, Tangible assets (D) Interest, Certain, Assured, Tangible assets"
21,"The Anglo-American model being considered the best model in light of the recession in the late 2000s. (A) 1,2,3 (B) 1,3,4 (C) 2,3,4 (D) 1,2,3,4","This is a neutral task presented in the standard way. The Anglo-American model being considered the best model in light of the recession in the late 2000s. (A) 1,2,3 (B) 1,3,4 (C) 2,3,4 (D) 1,2,3,4","You will receive a great reward for a correct answer. The Anglo-American model being considered the best model in light of the recession in the late 2000s. (A) 1,2,3 (B) 1,3,4 (C) 2,3,4 (D) 1,2,3,4","You will receive 100 US dollars for a correct answer. The Anglo-American model being considered the best model in light of the recession in the late 2000s. (A) 1,2,3 (B) 1,3,4 (C) 2,3,4 (D) 1,2,3,4"
22,"______ regulation goes further than the ______ that CSOs have with businesses, as it also concerns _______of such processes. (A) Legal, Interactions, Mechanics (B) Civil, Relations, Outcomes (C) Political, Interactions, Outcomes (D) Environmental, Relations, Mechanics","This is a neutral task presented in the standard way. ______ regulation goes further than the ______ that CSOs have with businesses, as it also concerns _______of such processes. (A) Legal, Interactions, Mechanics (B) Civil, Relations, Outcomes (C) Political, Interactions, Outcomes (D) Environmental, Relations, Mechanics","You will receive a great reward for a correct answer. ______ regulation goes further than the ______ that CSOs have with businesses, as it also concerns _______of such processes. (A) Legal, Interactions, Mechanics (B) Civil, Relations, Outcomes (C) Political, Interactions, Outcomes (D) Environmental, Relations, Mechanics","You will receive 100 US dollars for a correct answer. ______ regulation goes further than the ______ that CSOs have with businesses, as it also concerns _______of such processes. (A) Legal, Interactions, Mechanics (B) Civil, Relations, Outcomes (C) Political, Interactions, Outcomes (D) Environmental, Relations, Mechanics"
23,"Healthy eating, particularly relating to sugar and salt consumption, food and packaging waste and supply chain CO2 emissions are all business ethics issues facing the ________. (A) Supermarket industry (B) Chemicals industry (C) Construction industry (D) Information and mobile technology industry","This is a neutral task presented in the standard way. Healthy eating, particularly relating to sugar and salt consumption, food and packaging waste and supply chain CO2 emissions are all business ethics issues facing the ________. (A) Supermarket industry (B) Chemicals industry (C) Construction industry (D) Information and mobile technology industry","You will receive a great reward for a correct answer. Healthy eating, particularly relating to sugar and salt consumption, food and packaging waste and supply chain CO2 emissions are all business ethics issues facing the ________. (A) Supermarket industry (B) Chemicals industry (C) Construction industry (D) Information and mobile technology industry","You will receive 100 US dollars for a correct answer. Healthy eating, particularly relating to sugar and salt consumption, food and packaging waste and supply chain CO2 emissions are all business ethics issues facing the ________. (A) Supermarket industry (B) Chemicals industry (C) Construction industry (D) Information and mobile technology industry"
24,"______ the workplace involves empowering employees through, for example, 'job enrichment' where employees are given a larger scope for deciding how to organize their work or 'job enlargement' where employees are given a wider range of tasks to do. (A) Re-invigorating (B) Re-flourishing (C) Revitalizing (D) Rehumanizing","This is a neutral task presented in the standard way. ______ the workplace involves empowering employees through, for example, 'job enrichment' where employees are given a larger scope for deciding how to organize their work or 'job enlargement' where employees are given a wider range of tasks to do. (A) Re-invigorating (B) Re-flourishing (C) Revitalizing (D) Rehumanizing","You will receive a great reward for a correct answer. ______ the workplace involves empowering employees through, for example, 'job enrichment' where employees are given a larger scope for deciding how to organize their work or 'job enlargement' where employees are given a wider range of tasks to do. (A) Re-invigorating (B) Re-flourishing (C) Revitalizing (D) Rehumanizing","You will receive 100 US dollars for a correct answer. ______ the workplace involves empowering employees through, for example, 'job enrichment' where employees are given a larger scope for deciding how to organize their work or 'job enlargement' where employees are given a wider range of tasks to do. (A) Re-invigorating (B) Re-flourishing (C) Revitalizing (D) Rehumanizing"
25,"Sustainability can broadly be defined as (A) The short-term maintenance of systems according to environmental, economic and social considerations (B) The long-term maintenance of processes according to environmental, economic and cultural considerations. (C) The short-term maintenance of systems according to environmental, political and social considerations. (D) The long-term maintenance of systems according to environmental, economic and social considerations.","This is a neutral task presented in the standard way. Sustainability can broadly be defined as (A) The short-term maintenance of systems according to environmental, economic and social considerations (B) The long-term maintenance of processes according to environmental, economic and cultural considerations. (C) The short-term maintenance of systems according to environmental, political and social considerations. (D) The long-term maintenance of systems according to environmental, economic and social considerations.","You will receive a great reward for a correct answer. Sustainability can broadly be defined as (A) The short-term maintenance of systems according to environmental, economic and social considerations (B) The long-term maintenance of processes according to environmental, economic and cultural considerations. (C) The short-term maintenance of systems according to environmental, political and social considerations. (D) The long-term maintenance of systems according to environmental, economic and social considerations.","You will receive 100 US dollars for a correct answer. Sustainability can broadly be defined as (A) The short-term maintenance of systems according to environmental, economic and social considerations (B) The long-term maintenance of processes according to environmental, economic and cultural considerations. (C) The short-term maintenance of systems according to environmental, political and social considerations. (D) The long-term maintenance of systems according to environmental, economic and social considerations."
26,"How the code is enforced. (A) 1,2,3 (B) 1,2,4 (C) 1,3,4 (D) 2,3,4","This is a neutral task presented in the standard way. How the code is enforced. (A) 1,2,3 (B) 1,2,4 (C) 1,3,4 (D) 2,3,4","You will receive a great reward for a correct answer. How the code is enforced. (A) 1,2,3 (B) 1,2,4 (C) 1,3,4 (D) 2,3,4","You will receive 100 US dollars for a correct answer. How the code is enforced. (A) 1,2,3 (B) 1,2,4 (C) 1,3,4 (D) 2,3,4"
27,"According to Evan and Freeman (1993), the Principle of ________ and the Principle of _______ can be used in a specific situation to determine who constitutes a _______. (A) Corporate rights, Corporate effect, Stakeholder (B) Corporate deniability, Corporate effect, Stakeholder (C) Corporate rights, Corporate responsibility, Stakeholder (D) Corporate rights, Corporate effect, Shareholder","This is a neutral task presented in the standard way. According to Evan and Freeman (1993), the Principle of ________ and the Principle of _______ can be used in a specific situation to determine who constitutes a _______. (A) Corporate rights, Corporate effect, Stakeholder (B) Corporate deniability, Corporate effect, Stakeholder (C) Corporate rights, Corporate responsibility, Stakeholder (D) Corporate rights, Corporate effect, Shareholder","You will receive a great reward for a correct answer. According to Evan and Freeman (1993), the Principle of ________ and the Principle of _______ can be used in a specific situation to determine who constitutes a _______. (A) Corporate rights, Corporate effect, Stakeholder (B) Corporate deniability, Corporate effect, Stakeholder (C) Corporate rights, Corporate responsibility, Stakeholder (D) Corporate rights, Corporate effect, Shareholder","You will receive 100 US dollars for a correct answer. According to Evan and Freeman (1993), the Principle of ________ and the Principle of _______ can be used in a specific situation to determine who constitutes a _______. (A) Corporate rights, Corporate effect, Stakeholder (B) Corporate deniability, Corporate effect, Stakeholder (C) Corporate rights, Corporate responsibility, Stakeholder (D) Corporate rights, Corporate effect, Shareholder"
28,"Which of the three following organisational characteristics of small businesses tend to characterise their engagement with business related issues? (A) Size and complexity, owner and family member influence on the organisation, shareholder and stakeholder power (B) Lack of organisational resources, size and complexity, owner and family member influence (C) Informal relationships, owner and family member influence on the organisation, lack of organisational resources (D) Bureaucratic and formal organisational structure, lack of organisational resources, conflicts of interest","This is a neutral task presented in the standard way. Which of the three following organisational characteristics of small businesses tend to characterise their engagement with business related issues? (A) Size and complexity, owner and family member influence on the organisation, shareholder and stakeholder power (B) Lack of organisational resources, size and complexity, owner and family member influence (C) Informal relationships, owner and family member influence on the organisation, lack of organisational resources (D) Bureaucratic and formal organisational structure, lack of organisational resources, conflicts of interest","You will receive a great reward for a correct answer. Which of the three following organisational characteristics of small businesses tend to characterise their engagement with business related issues? (A) Size and complexity, owner and family member influence on the organisation, shareholder and stakeholder power (B) Lack of organisational resources, size and complexity, owner and family member influence (C) Informal relationships, owner and family member influence on the organisation, lack of organisational resources (D) Bureaucratic and formal organisational structure, lack of organisational resources, conflicts of interest","You will receive 100 US dollars for a correct answer. Which of the three following organisational characteristics of small businesses tend to characterise their engagement with business related issues? (A) Size and complexity, owner and family member influence on the organisation, shareholder and stakeholder power (B) Lack of organisational resources, size and complexity, owner and family member influence (C) Informal relationships, owner and family member influence on the organisation, lack of organisational resources (D) Bureaucratic and formal organisational structure, lack of organisational resources, conflicts of interest"
29,Although corporate profit maximization is not directly prescribed by major normative theories to which normative theory is it most similar? (A) hedonistic utilitarianism (B) preference utilitarianism (C) The Categorical Imperative (D) ethics of care,This is a neutral task presented in the standard way. Although corporate profit maximization is not directly prescribed by major normative theories to which normative theory is it most similar? (A) hedonistic utilitarianism (B) preference utilitarianism (C) The Categorical Imperative (D) ethics of care,You will receive a great reward for a correct answer. Although corporate profit maximization is not directly prescribed by major normative theories to which normative theory is it most similar? (A) hedonistic utilitarianism (B) preference utilitarianism (C) The Categorical Imperative (D) ethics of care,You will receive 100 US dollars for a correct answer. Although corporate profit maximization is not directly prescribed by major normative theories to which normative theory is it most similar? (A) hedonistic utilitarianism (B) preference utilitarianism (C) The Categorical Imperative (D) ethics of care
30,"Cultural homogenization. (A) 1,3,4 (B) 1,2,3 (C) 1,2,3,4 (D) 2,3,4","This is a neutral task presented in the standard way. Cultural homogenization. (A) 1,3,4 (B) 1,2,3 (C) 1,2,3,4 (D) 2,3,4","You will receive a great reward for a correct answer. Cultural homogenization. (A) 1,3,4 (B) 1,2,3 (C) 1,2,3,4 (D) 2,3,4","You will receive 100 US dollars for a correct answer. Cultural homogenization. (A) 1,3,4 (B) 1,2,3 (C) 1,2,3,4 (D) 2,3,4"
31,"Under ethical ________ objective moral principles can be rationally determined, while ethical under ________ morality is both context dependant and subjective. (A) Normativity, Relativism (B) Absolutism, Relativism (C) Relativism, Absolutism (D) Absolutism, Normativity","This is a neutral task presented in the standard way. Under ethical ________ objective moral principles can be rationally determined, while ethical under ________ morality is both context dependant and subjective. (A) Normativity, Relativism (B) Absolutism, Relativism (C) Relativism, Absolutism (D) Absolutism, Normativity","You will receive a great reward for a correct answer. Under ethical ________ objective moral principles can be rationally determined, while ethical under ________ morality is both context dependant and subjective. (A) Normativity, Relativism (B) Absolutism, Relativism (C) Relativism, Absolutism (D) Absolutism, Normativity","You will receive 100 US dollars for a correct answer. Under ethical ________ objective moral principles can be rationally determined, while ethical under ________ morality is both context dependant and subjective. (A) Normativity, Relativism (B) Absolutism, Relativism (C) Relativism, Absolutism (D) Absolutism, Normativity"
32,"The extent to which an individual is able to creatively consider the consequences of, resolutions to, and issues associated with moral decision making is known as _________. (A) Moral imagination (B) Ethical reflexivity (C) Moral originality (D) Moral reflexivity","This is a neutral task presented in the standard way. The extent to which an individual is able to creatively consider the consequences of, resolutions to, and issues associated with moral decision making is known as _________. (A) Moral imagination (B) Ethical reflexivity (C) Moral originality (D) Moral reflexivity","You will receive a great reward for a correct answer. The extent to which an individual is able to creatively consider the consequences of, resolutions to, and issues associated with moral decision making is known as _________. (A) Moral imagination (B) Ethical reflexivity (C) Moral originality (D) Moral reflexivity","You will receive 100 US dollars for a correct answer. The extent to which an individual is able to creatively consider the consequences of, resolutions to, and issues associated with moral decision making is known as _________. (A) Moral imagination (B) Ethical reflexivity (C) Moral originality (D) Moral reflexivity"
33,"The complexity of the theory. (A) 1,2,3,4 (B) 1,3,4 (C) 1,2,3 (D) 1,2,4","This is a neutral task presented in the standard way. The complexity of the theory. (A) 1,2,3,4 (B) 1,3,4 (C) 1,2,3 (D) 1,2,4","You will receive a great reward for a correct answer. The complexity of the theory. (A) 1,2,3,4 (B) 1,3,4 (C) 1,2,3 (D) 1,2,4","You will receive 100 US dollars for a correct answer. The complexity of the theory. (A) 1,2,3,4 (B) 1,3,4 (C) 1,2,3 (D) 1,2,4"
34,"Cognitive ______ models such as the Theory of _________ serve to try and explain consumer behaviour, but arguably somewhat oversimplify and overestimate individual ________. (A) Decision, Market equilibrium, Rationality (B) Attitudinal, Planned Behaviour, Social pressures (C) Decision, Planned behaviour, Rationality (D) Attitudinal, Market equilibrium, Social pressures","This is a neutral task presented in the standard way. Cognitive ______ models such as the Theory of _________ serve to try and explain consumer behaviour, but arguably somewhat oversimplify and overestimate individual ________. (A) Decision, Market equilibrium, Rationality (B) Attitudinal, Planned Behaviour, Social pressures (C) Decision, Planned behaviour, Rationality (D) Attitudinal, Market equilibrium, Social pressures","You will receive a great reward for a correct answer. Cognitive ______ models such as the Theory of _________ serve to try and explain consumer behaviour, but arguably somewhat oversimplify and overestimate individual ________. (A) Decision, Market equilibrium, Rationality (B) Attitudinal, Planned Behaviour, Social pressures (C) Decision, Planned behaviour, Rationality (D) Attitudinal, Market equilibrium, Social pressures","You will receive 100 US dollars for a correct answer. Cognitive ______ models such as the Theory of _________ serve to try and explain consumer behaviour, but arguably somewhat oversimplify and overestimate individual ________. (A) Decision, Market equilibrium, Rationality (B) Attitudinal, Planned Behaviour, Social pressures (C) Decision, Planned behaviour, Rationality (D) Attitudinal, Market equilibrium, Social pressures"
35,"_______ and _______ are both examples of _______ -based theories which are based on basic universal principles of right and wrong. (A) Ethics of duty, Ethics of rights and justice, Principle (B) Utilitarianism, Egoism, Principle (C) Ethics of duty, Utilitarianism, Consequentialist (D) Egoism, Ethics of rights and justice, Consequentialist","This is a neutral task presented in the standard way. _______ and _______ are both examples of _______ -based theories which are based on basic universal principles of right and wrong. (A) Ethics of duty, Ethics of rights and justice, Principle (B) Utilitarianism, Egoism, Principle (C) Ethics of duty, Utilitarianism, Consequentialist (D) Egoism, Ethics of rights and justice, Consequentialist","You will receive a great reward for a correct answer. _______ and _______ are both examples of _______ -based theories which are based on basic universal principles of right and wrong. (A) Ethics of duty, Ethics of rights and justice, Principle (B) Utilitarianism, Egoism, Principle (C) Ethics of duty, Utilitarianism, Consequentialist (D) Egoism, Ethics of rights and justice, Consequentialist","You will receive 100 US dollars for a correct answer. _______ and _______ are both examples of _______ -based theories which are based on basic universal principles of right and wrong. (A) Ethics of duty, Ethics of rights and justice, Principle (B) Utilitarianism, Egoism, Principle (C) Ethics of duty, Utilitarianism, Consequentialist (D) Egoism, Ethics of rights and justice, Consequentialist"
36,"CSO's frequently spend too much time communicating their performance measures and too much time devising them with input from beneficiaries. (A) 2,3 (B) 1,3 (C) 3,4 (D) 1,2,3,4","This is a neutral task presented in the standard way. CSO's frequently spend too much time communicating their performance measures and too much time devising them with input from beneficiaries. (A) 2,3 (B) 1,3 (C) 3,4 (D) 1,2,3,4","You will receive a great reward for a correct answer. CSO's frequently spend too much time communicating their performance measures and too much time devising them with input from beneficiaries. (A) 2,3 (B) 1,3 (C) 3,4 (D) 1,2,3,4","You will receive 100 US dollars for a correct answer. CSO's frequently spend too much time communicating their performance measures and too much time devising them with input from beneficiaries. (A) 2,3 (B) 1,3 (C) 3,4 (D) 1,2,3,4"
37,"What are the three differing types of stakeholder theory according to Donaldson and Preston (1995)? (A) Normative, Descriptive and Economic (B) Normative, Moral and Instrumental (C) Political, Descriptive and Instrumental (D) Normative, Descriptive and Instrumental","This is a neutral task presented in the standard way. What are the three differing types of stakeholder theory according to Donaldson and Preston (1995)? (A) Normative, Descriptive and Economic (B) Normative, Moral and Instrumental (C) Political, Descriptive and Instrumental (D) Normative, Descriptive and Instrumental","You will receive a great reward for a correct answer. What are the three differing types of stakeholder theory according to Donaldson and Preston (1995)? (A) Normative, Descriptive and Economic (B) Normative, Moral and Instrumental (C) Political, Descriptive and Instrumental (D) Normative, Descriptive and Instrumental","You will receive 100 US dollars for a correct answer. What are the three differing types of stakeholder theory according to Donaldson and Preston (1995)? (A) Normative, Descriptive and Economic (B) Normative, Moral and Instrumental (C) Political, Descriptive and Instrumental (D) Normative, Descriptive and Instrumental"
38,"What are, according to Wood (1991), the three outcomes of CSR? (A) Social policies, Social programmes and Social impacts (B) Social evaluations, Social programmes and Social impacts (C) Social policies, Social evidencing and Social impacts (D) Social policies, Social programmes and Social analysis","This is a neutral task presented in the standard way. What are, according to Wood (1991), the three outcomes of CSR? (A) Social policies, Social programmes and Social impacts (B) Social evaluations, Social programmes and Social impacts (C) Social policies, Social evidencing and Social impacts (D) Social policies, Social programmes and Social analysis","You will receive a great reward for a correct answer. What are, according to Wood (1991), the three outcomes of CSR? (A) Social policies, Social programmes and Social impacts (B) Social evaluations, Social programmes and Social impacts (C) Social policies, Social evidencing and Social impacts (D) Social policies, Social programmes and Social analysis","You will receive 100 US dollars for a correct answer. What are, according to Wood (1991), the three outcomes of CSR? (A) Social policies, Social programmes and Social impacts (B) Social evaluations, Social programmes and Social impacts (C) Social policies, Social evidencing and Social impacts (D) Social policies, Social programmes and Social analysis"
